Alice,knobfler,I have a question about this product. How do I use it?,question
Cathy,knobfler,I attached the knob to my stereo set and it did not do anything. I am so angry right now. I am fuming with rage.,complaint
Douglas,knobfler,This knob is TERRIBLE. It won't stop squealing!,complaint
Cathy,knoblauch,I really love my knoblauch. Who doesn't love the smell of garlic?,review
Ernest,knobby,The knob is too jolly. This does not please me.,review
Fred,knoblauch,"Right. After chewing on this knob, I don't talk, I just kiss. Because it's fun fun fun.",review
Greg,knoblauch,What's with all these jokes about garlic? I came here for knobs.,question
Hatori,knobfler,このノブは素晴らしいです！私はそれなしで悲しい海峡にいるでしょう。,review
Alice,knob,I have been using this knob for a few years now. It's good quality,review
Cathy,knobfler,I just like it!,review
Ernest,knob,I bought this knob at another shop because Bob's service is really bad.,review
Fred,knob,"I bought this one yesterday, but how do I use it?",support
Ernest,knobby,"What do you do with a knob you do not like? You send it back, but Bob is withholding refunds, the bastard.",complaint
Douglas,knobfler,How do I turn this knob off? It has been singing since I unboxed it,support
